{
  "$schema" : "https://vibedeck-schema.alanreisanjo.workers.dev/v1/rule-check.schema.json",
  "author" : "ai",
  "createdAt" : "2026-10-08T05:33:39.841Z",
  "failures" : [

  ],
  "files" : [
    "Sources/VibeDeckApp/ReviewGroupView.swift"
  ],
  "id" : "2356909D-74CA-4123-90E7-04B2861CC59D",
  "passed" : true,
  "results" : [
    {
      "note" : "Nenhuma edição manual em AGENTS.md/checks.",
      "ruleId" : "9D6F362B-9F0E-4661-97B3-6158B160D478",
      "topic" : "geral",
      "verdict" : "pass"
    },
    {
      "note" : "Dados do projeto não alterados.",
      "ruleId" : "9F92A765-76E7-4EA0-A66A-78AE12EE4C8F",
      "topic" : "geral",
      "verdict" : "na"
    },
    {
      "note" : "Nada apagado em .vibedeck.",
      "ruleId" : "AC4BA963-CDEE-419C-B057-9140643E115D",
      "topic" : "geral",
      "verdict" : "pass"
    },
    {
      "note" : "Nenhum texto de UI novo; o existente segue em pt-BR.",
      "ruleId" : "0E5AEC71-405E-4113-AB27-615313AB2B5F",
      "topic" : "geral",
      "verdict" : "pass"
    },
    {
      "note" : "Nada documentado no README muda (⌥⌘I segue alternando o painel).",
      "ruleId" : "306A20B6-E1FA-4BE4-96E8-2B854A3D0BC6",
      "topic" : "geral",
      "verdict" : "na"
    },
    {
      "note" : "Sem commit.",
      "ruleId" : "4095F087-1E04-46C0-9AA4-A60C8C16A72B",
      "topic" : "geral",
      "verdict" : "na"
    },
    {
      "note" : "Nenhum minWidth no root.",
      "ruleId" : "EE65A0A5-71DA-431A-A4B7-567144D40423",
      "topic" : "interface-do-app",
      "verdict" : "pass"
    },
    {
      "note" : "Sem ViewThatFits; header continua HStack único.",
      "ruleId" : "9A4878F2-54AD-4B93-9E8B-9D7683C8F9F2",
      "topic" : "interface-do-app",
      "verdict" : "pass"
    },
    {
      "note" : "A view deixou de ser coluna/inspector; o painel é um HStack interno com largura fixa de 320, não uma coluna do split view. Limites de colunas reais (ProjectWindow) intactos.",
      "ruleId" : "047D2216-D1C9-4AFC-AA0A-D789DC1E8A60",
      "topic" : "interface-do-app",
      "verdict" : "pass"
    },
    {
      "note" : "Mutações continuam via model.mutateItem.",
      "ruleId" : "00E57961-FE6D-4AFC-BB1A-3DC70152D38D",
      "topic" : "interface-do-app",
      "verdict" : "pass"
    },
    {
      "note" : "Fluxo de arquivos não alterado.",
      "ruleId" : "8385BC07-3F91-46DC-8BBD-6F62C4851DD9",
      "topic" : "interface-do-app",
      "verdict" : "na"
    },
    {
      "note" : "Docs/undo não tocados.",
      "ruleId" : "B065B5AF-B93F-4698-8E43-BB4369E74351",
      "topic" : "interface-do-app",
      "verdict" : "na"
    },
    {
      "note" : "CommitTextField mantido.",
      "ruleId" : "3D508DEA-D43E-4E33-91B7-F46039B6B53D",
      "topic" : "interface-do-app",
      "verdict" : "pass"
    },
    {
      "note" : "Abas não tocadas.",
      "ruleId" : "329A929F-62CC-4A7D-99A3-A299F495A08C",
      "topic" : "interface-do-app",
      "verdict" : "na"
    },
    {
      "note" : "Sidebar não tocada.",
      "ruleId" : "335DA4F8-7DBF-4120-8878-42130C661D69",
      "topic" : "interface-do-app",
      "verdict" : "na"
    },
    {
      "note" : "Listas de seção não tocadas.",
      "ruleId" : "A999B857-E236-4893-97A9-07257A538B57",
      "topic" : "interface-do-app",
      "verdict" : "na"
    },
    {
      "note" : "Botão da toolbar com ⌥⌘I mantido.",
      "ruleId" : "DC9EED4D-8823-4FD1-83ED-3B820A83E8B4",
      "topic" : "interface-do-app",
      "verdict" : "pass"
    },
    {
      "note" : "Toolbar não alterada.",
      "ruleId" : "492100C1-EFE3-488F-8368-08CE17A797DA",
      "topic" : "interface-do-app",
      "verdict" : "na"
    },
    {
      "note" : "SwiftUI nativo, SF Symbols.",
      "ruleId" : "B382469C-4D35-4314-BEC2-50BCEC7C6855",
      "topic" : "interface-do-app",
      "verdict" : "pass"
    },
    {
      "note" : "Tópicos/ideias não tocados.",
      "ruleId" : "1A4EF162-82B1-4940-8251-A2102964C3E8",
      "topic" : "interface-do-app",
      "verdict" : "na"
    },
    {
      "note" : "Sem mudança de dados.",
      "ruleId" : "9E02C127-7793-4588-A770-0E817687B02F",
      "topic" : "conceitos-do-produto",
      "verdict" : "na"
    },
    {
      "note" : "Ideias não tocadas.",
      "ruleId" : "116AEA24-9A0B-431B-9FC1-8ABE22683898",
      "topic" : "conceitos-do-produto",
      "verdict" : "na"
    },
    {
      "note" : "Sem promoção.",
      "ruleId" : "F7531E2B-4846-4C63-BE0F-3DFA1771CCCC",
      "topic" : "conceitos-do-produto",
      "verdict" : "na"
    },
    {
      "note" : "Modelo de revisão não alterado.",
      "ruleId" : "BE018170-5258-45AA-876E-5B761B643714",
      "topic" : "conceitos-do-produto",
      "verdict" : "na"
    },
    {
      "note" : "Status não alterados.",
      "ruleId" : "257D96B2-3561-47D2-AB56-33FA0900B331",
      "topic" : "conceitos-do-produto",
      "verdict" : "na"
    },
    {
      "note" : "Lógica de checks não alterada.",
      "ruleId" : "54A2D6B0-BC39-4555-A4E9-DB8D418D55CB",
      "topic" : "conceitos-do-produto",
      "verdict" : "na"
    },
    {
      "note" : "Escopo de tópicos não alterado.",
      "ruleId" : "6E22946D-DF9C-4D59-B403-1BB9F3F0FFB5",
      "topic" : "conceitos-do-produto",
      "verdict" : "na"
    },
    {
      "note" : "Checks não alterados.",
      "ruleId" : "C637A278-87F1-4586-BB2F-0864EDB552CB",
      "topic" : "conceitos-do-produto",
      "verdict" : "na"
    },
    {
      "note" : "Autoria não alterada.",
      "ruleId" : "C9BEE6A5-C314-4547-AE52-52D116B11220",
      "topic" : "conceitos-do-produto",
      "verdict" : "na"
    },
    {
      "note" : "Sem conceito novo.",
      "ruleId" : "B9E9DD35-4A5F-4FA3-BDDF-014238B8CB50",
      "topic" : "conceitos-do-produto",
      "verdict" : "na"
    },
    {
      "note" : "Não é feature de IA.",
      "ruleId" : "A31D4912-A7FA-4E2A-B1C2-CC27D577177B",
      "topic" : "conceitos-do-produto",
      "verdict" : "na"
    },
    {
      "note" : "Sidebar não alterada.",
      "ruleId" : "3901FA3E-16BD-4E00-A844-DAB5A87BDFC1",
      "topic" : "dinamicas-da-interface",
      "verdict" : "na"
    },
    {
      "note" : "Edição direta mantida.",
      "ruleId" : "8D5FCA3B-9398-45CD-AF1E-03A04F22526C",
      "topic" : "dinamicas-da-interface",
      "verdict" : "pass"
    },
    {
      "note" : "Watcher não alterado.",
      "ruleId" : "9BBFB48C-17CC-4FD9-8D7C-F1FD71529D95",
      "topic" : "dinamicas-da-interface",
      "verdict" : "na"
    },
    {
      "note" : "Painel do item continua alternando com ⌥⌘I.",
      "ruleId" : "34D2EA32-DD0D-4405-93F6-FDABEBA7CC1B",
      "topic" : "dinamicas-da-interface",
      "verdict" : "pass"
    },
    {
      "note" : "Abas não tocadas.",
      "ruleId" : "3D22A05A-9E61-433B-A8E2-00BFA2A968EE",
      "topic" : "dinamicas-da-interface",
      "verdict" : "na"
    },
    {
      "note" : "Boas-vindas não tocada.",
      "ruleId" : "365080A7-DD8F-4EBE-9CDF-979D07F6A5C3",
      "topic" : "dinamicas-da-interface",
      "verdict" : "na"
    },
    {
      "note" : "AGENTS.md/MCP não alterados.",
      "ruleId" : "EA7C01E6-5CC5-4199-94B6-11536B1ABDFA",
      "topic" : "fluxo-padrao",
      "verdict" : "na"
    },
    {
      "note" : "Listagem não alterada.",
      "ruleId" : "8F28F353-95A9-4EEC-8223-383AF2FF6140",
      "topic" : "fluxo-padrao",
      "verdict" : "na"
    },
    {
      "note" : "Sem item de revisão.",
      "ruleId" : "3A31B517-334E-484C-9205-0513AF158AE8",
      "topic" : "fluxo-padrao",
      "verdict" : "na"
    },
    {
      "note" : "Sem conceito novo.",
      "ruleId" : "95C0C917-663D-47F0-A4BD-C93E1B7F2D0C",
      "topic" : "fluxo-padrao",
      "verdict" : "na"
    },
    {
      "note" : "Sem ideias novas.",
      "ruleId" : "09C9F3A9-5B74-496C-8A2D-F93C4294CAD2",
      "topic" : "fluxo-padrao",
      "verdict" : "na"
    }
  ],
  "task" : "Corrigido crash ao abrir o painel do Claude na tela de Revisões: ReviewGroupView usava .inspector aninhado dentro do .inspector do ProjectWindow; agora o painel do item é um painel lateral comum (HStack + Divider).",
  "topics" : [
    "geral",
    "interface-do-app",
    "conceitos-do-produto",
    "dinamicas-da-interface",
    "fluxo-padrao"
  ],
  "warnings" : [

  ]
}
