{
  "$schema" : "https://vibedeck-schema.alanreisanjo.workers.dev/v1/rule-check.schema.json",
  "author" : "ai",
  "createdAt" : "2026-10-08T23:37:07.226Z",
  "failures" : [

  ],
  "files" : [
    ".vibedeck/reviews/abas.json",
    ".vibedeck/reviews/markdown.json",
    ".vibedeck/reviews/tela-de-stack.json"
  ],
  "id" : "7B68E9F2-9463-43C6-BCC0-A65F1B5754D8",
  "passed" : true,
  "results" : [
    {
      "note" : "AGENTS.md e checks não editados à mão; checks novos só via submit_rule_check.",
      "ruleId" : "9D6F362B-9F0E-4661-97B3-6158B160D478",
      "topic" : "geral",
      "verdict" : "pass"
    },
    {
      "note" : "Os três arquivos de reviews mudaram só via MCP update_review_item (status in_progress → done).",
      "ruleId" : "9F92A765-76E7-4EA0-A66A-78AE12EE4C8F",
      "topic" : "geral",
      "verdict" : "pass"
    },
    {
      "note" : "Nenhum item removido; os itens human só tiveram status e updatedAt alterados.",
      "ruleId" : "AC4BA963-CDEE-419C-B057-9140643E115D",
      "topic" : "geral",
      "verdict" : "pass"
    },
    {
      "note" : "Nenhum texto novo para o usuário nesses arquivos.",
      "ruleId" : "0E5AEC71-405E-4113-AB27-615313AB2B5F",
      "topic" : "geral",
      "verdict" : "na"
    },
    {
      "note" : "Mudança de status não altera nada documentado no README.",
      "ruleId" : "306A20B6-E1FA-4BE4-96E8-2B854A3D0BC6",
      "topic" : "geral",
      "verdict" : "na"
    },
    {
      "note" : "Sem commit.",
      "ruleId" : "4095F087-1E04-46C0-9AA4-A60C8C16A72B",
      "topic" : "geral",
      "verdict" : "na"
    }
  ],
  "task" : "Status dos itens de revisão (abas, markdown, tela-de-stack) atualizados para done via MCP update_review_item, após checks aprovados de cada item.",
  "topics" : [
    "geral"
  ],
  "warnings" : [

  ]
}
