{
  "$schema" : "https://vibedeck-schema.alanreisanjo.workers.dev/v1/rule-check.schema.json",
  "author" : "ai",
  "createdAt" : "2026-10-08T03:36:51.702Z",
  "failures" : [

  ],
  "files" : [
    ".vibedeck/docs/conceitos-do-vibedeck.md"
  ],
  "id" : "75550A93-7EC9-4F85-BC09-6A7A36D51047",
  "passed" : true,
  "results" : [
    {
      "note" : "AGENTS.md e checks não foram tocados.",
      "ruleId" : "9D6F362B-9F0E-4661-97B3-6158B160D478",
      "topic" : "geral",
      "verdict" : "pass"
    },
    {
      "note" : "Só o markdown do doc foi editado (sem JSON); frontmatter title/tags mantido.",
      "ruleId" : "9F92A765-76E7-4EA0-A66A-78AE12EE4C8F",
      "topic" : "geral",
      "verdict" : "pass"
    },
    {
      "note" : "Nada removido; doc foi criado pela IA nesta sessão.",
      "ruleId" : "AC4BA963-CDEE-419C-B057-9140643E115D",
      "topic" : "geral",
      "verdict" : "pass"
    },
    {
      "note" : "Seção nova em pt-BR.",
      "ruleId" : "0E5AEC71-405E-4113-AB27-615313AB2B5F",
      "topic" : "geral",
      "verdict" : "pass"
    },
    {
      "note" : "Nenhum comportamento do produto mudou.",
      "ruleId" : "306A20B6-E1FA-4BE4-96E8-2B854A3D0BC6",
      "topic" : "geral",
      "verdict" : "na"
    },
    {
      "note" : "Sem commit.",
      "ruleId" : "4095F087-1E04-46C0-9AA4-A60C8C16A72B",
      "topic" : "geral",
      "verdict" : "na"
    }
  ],
  "task" : "Detalhar no doc conceitos-do-vibedeck como cada conceito (tópico, rules_for, check, item de revisão, ideia, docs, links, tags, autoria) se relaciona com as regras",
  "topics" : [
    "geral"
  ],
  "warnings" : [

  ]
}
