{
  "$schema" : "https://vibedeck-schema.alanreisanjo.workers.dev/v1/rule-check.schema.json",
  "author" : "ai",
  "createdAt" : "2026-10-08T15:01:38.000Z",
  "failures" : [

  ],
  "files" : [
    ".vibedeck/rules/botao-de-descubra-em-onde-e-regras-nas-revisoes.json"
  ],
  "id" : "8B566E31-7386-403C-A04F-5DFF86ADC9E3",
  "passed" : true,
  "results" : [
    {
      "note" : "Não toquei em AGENTS.md nem em checks.",
      "ruleId" : "9D6F362B-9F0E-4661-97B3-6158B160D478",
      "topic" : "geral",
      "verdict" : "pass"
    },
    {
      "note" : "Só adicionei 'paths' (array de strings, conforme rule-topic.schema.json); $schema, ids e datas preservados; `vibedeck status` carrega 10 tópicos sem erro. Não existe tool MCP para editar paths.",
      "ruleId" : "9F92A765-76E7-4EA0-A66A-78AE12EE4C8F",
      "topic" : "geral",
      "verdict" : "pass"
    },
    {
      "note" : "Nada removido; o tópico e as regras criados pela IA estão como author=ai.",
      "ruleId" : "AC4BA963-CDEE-419C-B057-9140643E115D",
      "topic" : "geral",
      "verdict" : "pass"
    },
    {
      "note" : "Sem texto de UI alterado.",
      "ruleId" : "0E5AEC71-405E-4113-AB27-615313AB2B5F",
      "topic" : "geral",
      "verdict" : "na"
    },
    {
      "note" : "Nada documentado no README mudou.",
      "ruleId" : "306A20B6-E1FA-4BE4-96E8-2B854A3D0BC6",
      "topic" : "geral",
      "verdict" : "na"
    },
    {
      "note" : "Sem commit.",
      "ruleId" : "4095F087-1E04-46C0-9AA4-A60C8C16A72B",
      "topic" : "geral",
      "verdict" : "na"
    }
  ],
  "task" : "Promovi a ideia \"Botão de Descubra\" para tópico de regras e restringi os paths do tópico aos arquivos da feature (antes ficava global).",
  "topics" : [
    "geral"
  ],
  "warnings" : [

  ]
}
